{
  "schema": "noor.snapshot-manifest/v1",
  "platform_id": "nmis_full",
  "source_label": "nmis-full-snapshot",
  "source_commit": null,
  "copied_at": "2026-10-30T21:02:00.136256+00:00",
  "files": [
    {
      "path": "Local_Manager.py",
      "size": 2676,
      "sha256": "ed74d86c2def3476e3d23810fb0846ede92cb435c0d388c8191d6953fbfe1470"
    },
    {
      "path": "admin_templates.py",
      "size": 341,
      "sha256": "73d6bfee57a89a8fb87b24506cd9375746ec8a80c7b73cce7e22afe3e50be426"
    },
    {
      "path": "ai_assistant.py",
      "size": 17820,
      "sha256": "e8fed465ed973a11eade516bf982095518b3e77a7a43795aac3ada79cb50c088"
    },
    {
      "path": "analytics_core.py",
      "size": 14989,
      "sha256": "aaa7430b725925e0e6d0cd555dc05d0041109f06eb50cd7d007b132e7872a680"
    },
    {
      "path": "analytics_engine.py",
      "size": 22597,
      "sha256": "5de50df35c09502e03f727e9ada58b37d0a75638ef9be72f0ea36952b89e01f4"
    },
    {
      "path": "bot_analytics.py",
      "size": 4051,
      "sha256": "77f1c38104d3cae558345e3bb89c7b4d9c8dbbeb13c87d2efbd168e2ce9984df"
    },
    {
      "path": "bot_callbacks.py",
      "size": 23963,
      "sha256": "61e8b1849bb2366de9d2957c427b2cf44cc31a5512e279fbc61e66f2924d64ec"
    },
    {
      "path": "bot_commands.py",
      "size": 37808,
      "sha256": "555bc47275478b5068c98e61685dc8f22295aec08925daa3d90089aedef8aece"
    },
    {
      "path": "bot_core.py",
      "size": 17426,
      "sha256": "c1e3e94865bf713f5259775d1ae8cc4f7e8ec534c7e7b18f4a38d66015b01954"
    },
    {
      "path": "bot_daemon.py",
      "size": 3269,
      "sha256": "418c4668ef8dbe64dad42a6f3367ac30380e5a709a8b06681533048e3bd38027"
    },
    {
      "path": "bot_deletions.py",
      "size": 11944,
      "sha256": "ed6d80aa645a169070e02a9d935a28d0604198f2209fdfa625a1048328f2374c"
    },
    {
      "path": "bot_jobs.py",
      "size": 24549,
      "sha256": "8734f2f6c18e783a078db6064611c2c2fea077d041d75ce9229ef16685a144c6"
    },
    {
      "path": "bot_notifications.py",
      "size": 27590,
      "sha256": "a626c1346265ca3de339c3627d50b62bf65c3c309cceb3dbd26ea82b08dadbe1"
    },
    {
      "path": "bot_tasks.py",
      "size": 7252,
      "sha256": "ca870e35c3f9a086e942489d2196d9d24f61efc7bc6c7d3f7b8c6995ebda93d1"
    },
    {
      "path": "bot_voice_ai.py",
      "size": 29607,
      "sha256": "1cad724f9f359d7921a7dfd94cf8cb8853fee6c754d7f83d9f6874d88e85d65d"
    },
    {
      "path": "bp_engineer.py",
      "size": 12224,
      "sha256": "7c046ec5aaa1c9db4ef011b0e32234f5a1857203051050d57039cfb35ad5bf7e"
    },
    {
      "path": "calendar_core.py",
      "size": 6800,
      "sha256": "d9ac4154468de6c0c21eb5448b5a660a64da058de180b88522dc1ded83843c6a"
    },
    {
      "path": "chat_handler.py",
      "size": 27800,
      "sha256": "7ada949fe3ddbaac1499cc1f5d5ae87070e2228b54575bf356dcb0c142a6bf16"
    },
    {
      "path": "company_profile.py",
      "size": 2746,
      "sha256": "ae190dc414028653bdd22a3d36d93e11a76d707f856aa7d6d63f3a31cb5518b5"
    },
    {
      "path": "dashboard_templates.py",
      "size": 1382,
      "sha256": "124d3ecc70829d747c1b288937a9a21af25e6cd5ba55c5dbbd3211bd2ae37959"
    },
    {
      "path": "db_manager.py",
      "size": 32158,
      "sha256": "e2488cde8b3bf8bfef2c3b3607ce1520d2de2ca6529ef779dbf86229aa8de6b2"
    },
    {
      "path": "demo_core.py",
      "size": 21847,
      "sha256": "1f3d0d4fad8f6bde715468ae51c832104ec0f5b5a463c974c917670192fd981b"
    },
    {
      "path": "engine_core.py",
      "size": 32385,
      "sha256": "f333a6eafbcda940473d3f0b6e010be8c0704b25ffce85e05e12a5467bbf3390"
    },
    {
      "path": "engineer_accounts.py",
      "size": 11993,
      "sha256": "62810c1a17664d40b150704b0fcfb7c66033b3dfc53cf9eafd6836e7cdc1fe19"
    },
    {
      "path": "export_in_progress.py",
      "size": 4836,
      "sha256": "0d2f1d7746eb3055ca67baa1d9d19511dc45627e25476847b663ff454483e3ff"
    },
    {
      "path": "flush_pendings.py",
      "size": 1685,
      "sha256": "6a5941d45d93c171942d31feb2c266dcd319924772543124787711233d715255"
    },
    {
      "path": "health_check.py",
      "size": 2202,
      "sha256": "78dd70b4c092b07cdda770c0d7dc9d0b22f2e61affb426b28fa60c7c2efdd6ee"
    },
    {
      "path": "instance_paths.py",
      "size": 1792,
      "sha256": "d7ff883a04fff59410759a9e225b34aee90290e52aac0ad4fe4aff5eea8f96ef"
    },
    {
      "path": "pdf_report.py",
      "size": 17064,
      "sha256": "9fc900202986bed382095222bbbdade993f182b2e759e2b42f26c9e08476b8fc"
    },
    {
      "path": "performance_report.py",
      "size": 19496,
      "sha256": "93f77aa9b4f63f3cd7d384bf63fbfb1b3c25c85a8d7df6af27b6b47aaf07c3e4"
    },
    {
      "path": "portal_adapter.py",
      "size": 10086,
      "sha256": "24232a2a0c0ff63f1597347f1da11ccfd40bb3db4200f009496ed49027c9a553"
    },
    {
      "path": "requirements.txt",
      "size": 589,
      "sha256": "34514d35a0a7e3b2b2dfbe4d1a85d8f9ab7e726ab1a3382830fb5cc45c6b1d7a"
    },
    {
      "path": "reverse_sync_to_sql.py",
      "size": 6036,
      "sha256": "0237c415a84d2f9659634a682f4091fd64de51ed58734ebdc65aa43daa9ea786"
    },
    {
      "path": "source_core.py",
      "size": 11377,
      "sha256": "ca8a08d27fea38d157959e3f85391cbe4188db2e0f8a9f35861096f00ed93e12"
    },
    {
      "path": "tasks_core.py",
      "size": 30330,
      "sha256": "e7af186a1e52dac2054bd52d867e76f041bf2a77f1ab9f294c2fd4845e227856"
    },
    {
      "path": "templates/_sidebar.html",
      "size": 6587,
      "sha256": "3bb6d9a4e48eae63430faddace6c5598dee13a8c3ae061c18f82167bafa7d818"
    },
    {
      "path": "templates/_skin.html",
      "size": 767,
      "sha256": "57bb466e19a3260a53f11ba01bfb3102538fff224ffc19cf5a20e8d002068c58"
    },
    {
      "path": "templates/admin_demo.html",
      "size": 13947,
      "sha256": "4ed43f75402b639e303088b272016f1c666c8b42dc1b2d09cb28e40c6cacb4a3"
    },
    {
      "path": "templates/admin_engineers.html",
      "size": 10923,
      "sha256": "a7061fbc84cd75508ee3d09d9b4ade701e576bf357a1174a905cf5315055788d"
    },
    {
      "path": "templates/admin_forgot.html",
      "size": 4123,
      "sha256": "fa7320abf8898c4c8e67bd8e38175cdd690198e658caed9f02c1f2e78ac432be"
    },
    {
      "path": "templates/admin_login.html",
      "size": 3647,
      "sha256": "f22d7d0a236bcea71519997cb1fc17e21bdcf667b6cea03abc1225a330aa0cf1"
    },
    {
      "path": "templates/admin_panel.html",
      "size": 20669,
      "sha256": "9734762d0dd0b91ba1e584e8760fb4fd644091479e2e1c55b329fb1d06dcd95f"
    },
    {
      "path": "templates/admin_source.html",
      "size": 13671,
      "sha256": "f891062c83d0c2e51dcaac46533b20b6e060910dcd573a34b3628384e1c62b2c"
    },
    {
      "path": "templates/analytics.html",
      "size": 24701,
      "sha256": "1be6dd0949836998f60cdc1f4628a60f11e431607d26a8e3fe73fa2e51439d4e"
    },
    {
      "path": "templates/calendar.html",
      "size": 17454,
      "sha256": "2e90f6ed86427993124e29dd54744890551ec4c35a2fbf5fbc7e88b1a698847b"
    },
    {
      "path": "templates/dash_forgot.html",
      "size": 3869,
      "sha256": "61f2ac971279acf79edd636d63d2182479d315402fb66dbe693c428e7e0c2df4"
    },
    {
      "path": "templates/dashboard.html",
      "size": 90085,
      "sha256": "82a14d354d4a03c7f40e03b8d6069d411db429d8d1e71e4557ae31ae0a1f2d73"
    },
    {
      "path": "templates/engineer_dash.html",
      "size": 10709,
      "sha256": "0b424cb885827a5b37689935ef73494a06ca9d8feee2021e3f84a1c316149468"
    },
    {
      "path": "templates/engineer_login.html",
      "size": 2316,
      "sha256": "f8870000b1565790833927ab645427720e77ac6080ea82aa0046a1c727d7b764"
    },
    {
      "path": "templates/engineer_password.html",
      "size": 3351,
      "sha256": "da54c2ba0669365956145f56d4759b8e2fd35ff64d13151ac2eac3c7278b14f5"
    },
    {
      "path": "templates/engineer_view.html",
      "size": 13403,
      "sha256": "05b5710d877fe99b1376d47bb9926c8e2bd7c347a49200859adc94d20c5718ff"
    },
    {
      "path": "templates/login.html",
      "size": 5205,
      "sha256": "2dee7f3474e162b9b662ea76a4f93cb89cbff6e685b075d8a437298d0a29a9c7"
    },
    {
      "path": "templates/owners.html",
      "size": 8275,
      "sha256": "af8536f27f96591bae67dbcc15c43d9d5cbda866e9972a98474431b5698264ba"
    },
    {
      "path": "templates/results.html",
      "size": 51450,
      "sha256": "a94ff2c63c395882e6454f6a520e43f4d296a193ef6a6458e0602ba85acc740a"
    },
    {
      "path": "templates/skins/noor.css",
      "size": 20947,
      "sha256": "a78037a9b6327f9ed537a5ab096d32c94b335d7abce2d906f0b60be96faf96f9"
    },
    {
      "path": "templates/skins/noor_shell.js",
      "size": 5569,
      "sha256": "b2e3fe69207da77135ebf2b29fd80eba4d586b8114593afc9200960401e7c086"
    },
    {
      "path": "templates/task_templates.html",
      "size": 14879,
      "sha256": "36bc83ac3dc75f5296fb0d09ab0e99b9aa6240b6601181cb2013fda9672ba769"
    },
    {
      "path": "templates/tasks.html",
      "size": 28756,
      "sha256": "2f208afa7558fc7e5cd99e9d4672883ef35076fb7b11443a7226bf79e1628544"
    },
    {
      "path": "templates/team.html",
      "size": 9183,
      "sha256": "12530e3dfc0bba8411eafe3ba9b7a749fe57ffff27f7af0c36fefbcde18ae2b0"
    },
    {
      "path": "templates/tender_detail.html",
      "size": 25598,
      "sha256": "3e6584c5a293abe040e842abd708fe7b21e412e8a287ed039174c9f721fc5dd3"
    },
    {
      "path": "tests/__init__.py",
      "size": 0,
      "sha256": "e3b0c44298fc1c149afbf4c8996fb92427ae41e4649b934ca495991b7852b855"
    },
    {
      "path": "tests/_env.py",
      "size": 613,
      "sha256": "93419ac9a9b620b67e55fa655a13932fe7364b8b56c1b9b7d678753e7cd8e397"
    },
    {
      "path": "tests/run_all.py",
      "size": 2610,
      "sha256": "6aefbcb79c248dd8303da594386f4f76e9f824adbf01bb7796bd6f4dc6cb72c6"
    },
    {
      "path": "tests/test_ai_model_params.py",
      "size": 2559,